job name, company, location, time indication, contact
Acheteur Industriel H/F, MICHAEL PAGE, Mulhouse, Modifiée il y a moins de 24h, N.A.
Acheteur Famille H/F, MICHAEL PAGE, Lourdes, Modifiée il y a moins de 24h, N.A.
Acheteur Public H/F, MICHAEL PAGE, Villejuif, Modifiée il y a moins de 24h, N.A.
Acheteur Marketing H/F, MICHAEL PAGE, Lille, Modifiée il y a moins de 24h, N.A.
Acheteur Projet NEO2, N.A., Levallois-Perret, Modifiée il y a 1 semaine, N.A.
Acheteur USINAGE H/F, LHH Recruitment Solutions, Melun, Modifiée il y a moins de 24h, N.A.
Acheteur Automobile (F/H), ALTEN, Lyon, Modifiée il y a moins de 24h, N.A.
Acheteur industriel h/f, RANDSTAD SEARCH, Montilliers, Modifiée il y a 1 jour, N.A.
Acheteur CAPEX H/F, ADSEARCH, Rouen, Modifiée il y a 1 jour, N.A.
Acheteur Junior (F/H), FED SUPPLY, Orly, Modifiée il y a 1 semaine, N.A.
Assistant Acheteur (h/f), LHH Recruitment Solutions, Issy-les-Moulineaux, Modifiée il y a 1 jour, N.A.
Acheteur Sous Traitance H/F, PAGE PERSONNEL, Belfort, Modifiée il y a 1 jour, N.A.
Acheteur Industriel H/F, VIDAL ASSOCIATES, Codognan, Modifiée il y a 1 jour, N.A.
Acheteur Industriel F/H, Morgan Philips Executive Search, Cherbourg-Octeville, Modifiée il y a 2 jours, N.A.
Acheteur Indirect H/F, FED SUPPLY, Saint-Priest, Modifiée il y a 3 jours, N.A.
Acheteur-Approvisionneur (H/F), MEPHISTO, Sarrebourg, Modifiée il y a 2 semaines, N.A.
Acheteur transport h/f, FM Logistic 57, Longueil, Modifiée il y a 6 jours, N.A.
Acheteur IT H/F, LHH Recruitment Solutions, Orly, Modifiée il y a 6 jours, N.A.
Acheteur IT H/F, LHH Recruitment Solutions, Tours, Modifiée il y a 6 jours, N.A.
Acheteur industriel f/h, CAZART, Rhône, Modifiée il y a 6 jours, N.A.
Acheteur print H/F, KARA TT, Hauts-de-Seine, Modifiée il y a moins de 24h, N.A.
Acheteur Public H/F, MICHAEL PAGE INTERIM MANAGEMENT, Issy-les-Moulineaux, Modifiée il y a 1 semaine, N.A.
Acheteur projets H/F, SINCLAIR RESSOURCES, Marseille, Modifiée il y a 3 semaines, N.A.
Acheteur industriel H/F, HAYS, Thouars, Modifiée il y a 1 jour, N.A.
